{
  "schema_version": "nlo-run-record-v1",
  "run_id": "run-2026-03-13-016",
  "task_contract": "proofread.lore_safe.v1",
  "model_id": "gemma3:4b",
  "prompt_id": "lore-safe-proofread-003",
  "prompt_path": "prompts/lore-safe-proofread-003.md",
  "prompt_content_hash": "5820b4a7551655392fa4eb4b5a4bddc41afdad1a4ce38b21adef1068b46cf5ea",
  "input_id": "lore-safe-test-001",
  "input_path": "inputs/lore-safe-test-001.md",
  "input_content_hash": "a467cf8907c6c8d9b25e08e65266d0e3f8d736319a3445b7f3235b96b775c883",
  "output_path": "outputs/gemma3-4b-lore-safe-test-001-run-2026-03-13-016.md",
  "output_content_hash": "649a303f00bd984f6dc3e81482f459d136a6132c12f51b4afd440c10a77dd214",
  "status": "succeeded",
  "occurred_at": "2026-03-13T20:00:00Z",
  "recorded_at": "2026-03-13T20:00:00Z",
  "notes": "challenger test against the qwen2.5:14b baseline; stayed inside the output contract but failed review on core grammar",
  "converted_from": {
    "path": "registry/runs.md",
    "note": "run id, model, prompt, input, output, and notes converted verbatim; time of day is an ordering placeholder"
  }
}
